{
  "version": "1.2",
  "project": "AI 视频教程",
  "styleId": "paper-editorial",
  "outputFormat": "mp4",
  "scenes": [
    {
      "id": "efficiency-result",
      "timecode": "00:18",
      "note": "口播第一次给出核心结果时出现",
      "director": {
        "sourceQuote": "同样的选题流程，AI 参与后，效率提升了 3.2 倍。",
        "intent": "让观众第一眼记住 3.2 倍这个核心结果。",
        "layoutMode": "fullscreen",
        "requiredInformation": ["效率提升", "3.2 倍", "AI 参与选题流程"],
        "forbiddenInformation": ["口播未提供的测试周期", "英文数据编号", "额外的进度指标"]
      },
      "templateId": "big-number-card",
      "format": "mp4",
      "variables": {
        "eyebrow": "核心结论",
        "prefix": "效率提升",
        "value": 3.2,
        "unit": "倍",
        "caption": "同样的选题流程，AI 参与后从整理资料到产出初稿明显提速。",
        "accent": "#FF5A1F",
        "foreground": "#F5F5F2"
      }
    },
    {
      "id": "time-before-after",
      "timecode": "00:43",
      "note": "解释工作流变化时出现",
      "director": {
        "sourceQuote": "过去做一条知识视频要 12 小时，现在 3 小时就可以完成。",
        "intent": "用前后对比说明工作流把耗时压缩到原来的四分之一。",
        "layoutMode": "fullscreen",
        "requiredInformation": ["过去 12 小时", "现在 3 小时", "耗时压缩到 1/4"],
        "forbiddenInformation": ["没有来源的效率百分比", "无关英文标签", "第三组对比数据"]
      },
      "templateId": "before-after-stat",
      "format": "mov",
      "variables": {
        "label": "做一条知识视频",
        "beforeLabel": "过去",
        "beforeValue": 12,
        "afterLabel": "现在",
        "afterValue": 3,
        "unit": "小时",
        "conclusion": "流程被压缩到原来的 1/4",
        "accent": "#FF5A1F",
        "foreground": "#F5F5F2"
      }
    }
  ]
}
